nivel,pergunta,resposta1,resposta2,resposta3,resposta4,respostaCerta
1,O que está acontecendo?,Nada,Tudo,Sei lá,Pergunta no posto Ipiranga,Pergunta no posto Ipiranga
1,O que está houve?,Nada,Tudo,Sei lá,Pergunta no posto Ipiranga!,Pergunta no posto Ipiranga!
1,Que se pasa?,Nada,Tudo,No sé,Pergunta en el posto Ipiranga,Pergunta en el posto Ipiranga
1,What's going on?,Nothing,Everything,I don't know,Ask at posto Ipiranga,Ask at posto Ipiranga
2,qual seu nome?,Andressa,Jorge,Simone,Rafael,Andressa